<?xml version="1.0" encoding="UTF-8"?>

<!DOCTYPE listado SYSTEM "./prueba.dtd">

<listado>
    <futuro precio="9">
        <producto>Balon</producto>   
        <ciudad_procedencia>
            <madrid/>
        </ciudad_procedencia>
    </futuro>  

    <divisa precio="Euro" estable="si">
        <nombre_divisa>Peso</nombre_divisa>
        <tipo_de_cambio>Dolar</tipo_de_cambio>
        <ciudad_procedencia>
            <madrid/>
        </ciudad_procedencia>
    </divisa>

    <bono precio="5">
        <pais_de_procedencia>Colombia</pais_de_procedencia>
        <valor_deseado>7</valor_deseado>
        <valor_minimo>1</valor_minimo>
        <valor_maximo>10</valor_maximo>
        <ciudad_procedencia>
            <madrid/>
        </ciudad_procedencia>
    </bono>
        
    <letra precio="A">
        <tipo_de_interes>Mucho</tipo_de_interes>
        <pais_emisor>
            <eeuu/>
        </pais_emisor>
        <ciudad_procedencia>
            <madrid/>
        </ciudad_procedencia>
    </letra>
</listado>
